{
  "schema_version": "atomic-result-card/v3",
  "card_id": "card-20260312-design-009",
  "request_id": "req-20260312-design-009",
  "task_id": "task-20260312-design-009",
  "created_at": "2026-03-12T11:05:00Z",
  "task_family": "deployment_execution",
  "atomic_skill": "feature-policy-resolver",
  "work_package_id": "wp-confirm-prefill-policy",
  "source_plan_id": "plan-20260312-intake-009",
  "result_status": "needs_reroute",
  "resolution_code": "reroute_family_boundary",
  "finding_summary": "当前组合在 repo 中没有稳定 baseline，且需要新增代码路径才能满足需求。",
  "evidence_summary": [
    "pack 未命中现成部署路径",
    "相关代码面显示需要新增配置处理或算子支持"
  ],
  "confidence": "medium",
  "impacted_surfaces": [
    "deployment config",
    "runtime integration"
  ],
  "deliverable_fragment_summary": "deployment_execution 不再是正确 family；需要进入 adaptation 或 design_analysis。",
  "residual_unknowns": [
    "是否仅需接入新 feature",
    "是否存在算子能力缺口"
  ],
  "source_refs": [
    "pack:miss",
    "symbol:vllm_ascend.platform.initialize"
  ],
  "next_action": {
    "kind": "reroute_task",
    "owner_stage": "intake",
    "summary": "重新进入 Intake，判定 adaptation 与 design_analysis"
  },
  "flush_required": true,
  "update_bundle_files": [
    "plan.md",
    "checklist.md",
    "progress.md"
  ],
  "reroute": {
    "target_family": "adaptation",
    "target_stage": "intake",
    "reason": "当前问题已越过 deployment_execution 的不改代码边界。",
    "carry_over_unknowns": [
      "需要改哪些代码面",
      "验收标准是什么"
    ]
  },
  "produced_artifacts": [],
  "token_estimate": 355,
  "notes": "若 Intake 发现路线仍未定，应再转 design_analysis"
}
